{
  "catalogKey": "openai/sora-2",
  "currency": "USD",
  "modelId": "sora-2",
  "prices": [
    {
      "currency": "USD",
      "effectiveFrom": "2026-07-02T00:00:00Z",
      "meterCode": "video_output_second",
      "minimumQuantity": "0",
      "priceId": "openai-sora-2-second-720p",
      "priceSide": "official",
      "pricingScope": "model",
      "quantityStep": "1",
      "source": {
        "observedAt": "2026-07-26T00:00:00Z",
        "sourceUrl": "https://openai.com/api/pricing/"
      },
      "unitPrice": "0.100000",
      "unitSize": "1"
    }
  ],
  "regionCode": "global",
  "schemaVersion": "1.0.0",
  "vendorCode": "openai"
}
