{
  "catalogKey": "alibaba/wan2.6-i2v",
  "currency": "CNY",
  "modelId": "wan2.6-i2v",
  "prices": [
    {
      "currency": "CNY",
      "effectiveFrom": "2026-07-02T00:00:00Z",
      "meterCode": "video_output_second",
      "minimumQuantity": "0",
      "priceId": "alibaba-cn-wan2-6-i2v-second-720p",
      "priceSide": "official",
      "pricingScope": "model",
      "quantityStep": "1",
      "source": {
        "observedAt": "2026-08-13T00:00:00Z",
        "sourceUrl": "https://help.aliyun.com/zh/model-studio/wan-image-to-video-guide"
      },
      "unitPrice": "0.600000",
      "unitSize": "1",
      "priceBookCode": "models.alibaba.cn.official",
      "productCode": "models.alibaba.video",
      "operationCode": "video.generate",
      "billability": "chargeable",
      "chargeTiming": "successful_result",
      "calculationMode": "per_unit",
      "quantityAggregation": "sum",
      "conditions": [],
      "rateHash": "9dad36280e6b9dbcdd91c8d9df74f63e627e8c4141f754c7fd09383fcaf28f3b",
      "priority": 100,
      "rateVariant": "standard",
      "schedule": null
    }
  ],
  "regionCode": "cn",
  "schemaVersion": "2.0.0",
  "vendorCode": "alibaba"
}
