{
  "catalogKey": "mureka/mureka-v7.6",
  "currency": "USD",
  "modelId": "mureka-v7.6",
  "prices": [
    {
      "currency": "USD",
      "effectiveFrom": "2026-07-14T00:00:00Z",
      "meterCode": "api_result",
      "minimumQuantity": "0",
      "priceId": "mureka-global-mureka-v7-6-result",
      "priceSide": "official",
      "pricingScope": "model",
      "quantityStep": "1",
      "source": {
        "observedAt": "2026-07-26T00:00:00Z",
        "sourceUrl": "https://platform.mureka.ai/docs/en/faq.html"
      },
      "unitPrice": "0.045000",
      "unitSize": "1"
    }
  ],
  "regionCode": "global",
  "schemaVersion": "1.0.0",
  "vendorCode": "mureka"
}
