{
  "catalogKey": "baidu/ernie-4.5-turbo-128k",
  "currency": "CNY",
  "modelId": "ernie-4.5-turbo-128k",
  "prices": [
    {
      "currency": "CNY",
      "effectiveFrom": "2026-07-14T00:00:00Z",
      "meterCode": "llm_input_token",
      "minimumQuantity": "0",
      "priceId": "baidu-cn-ernie-4-5-turbo-input",
      "priceSide": "official",
      "pricingScope": "model",
      "quantityStep": "1",
      "source": {
        "observedAt": "2026-08-03T00:00:00Z",
        "sourceUrl": "https://cloud.baidu.com/doc/qianfan-docs/s/7m95lyy43"
      },
      "unitPrice": "0.800000",
      "unitSize": "1000000"
    },
    {
      "currency": "CNY",
      "effectiveFrom": "2026-07-14T00:00:00Z",
      "meterCode": "llm_output_token",
      "minimumQuantity": "0",
      "priceId": "baidu-cn-ernie-4-5-turbo-output",
      "priceSide": "official",
      "pricingScope": "model",
      "quantityStep": "1",
      "source": {
        "observedAt": "2026-08-03T00:00:00Z",
        "sourceUrl": "https://cloud.baidu.com/doc/qianfan-docs/s/7m95lyy43"
      },
      "unitPrice": "3.200000",
      "unitSize": "1000000"
    }
  ],
  "regionCode": "cn",
  "schemaVersion": "1.0.0",
  "vendorCode": "baidu"
}
