{
  "catalogKey": "stepfun/step-3.5-flash",
  "currency": "CNY",
  "modelId": "step-3.5-flash",
  "prices": [
    {
      "currency": "CNY",
      "effectiveFrom": "2026-06-24T00:00:00Z",
      "meterCode": "llm_input_token",
      "minimumQuantity": "0",
      "priceId": "stepfun-cn-step-3.5-flash-input",
      "priceSide": "official",
      "pricingScope": "model",
      "quantityStep": "1",
      "source": {
        "observedAt": "2026-08-03T00:00:00Z",
        "sourceUrl": "https://platform.stepfun.com/docs/zh/guides/pricing/details"
      },
      "unitPrice": "0.700000",
      "unitSize": "1000000",
      "priceBookCode": "models.stepfun.cn.official",
      "productCode": "models.stepfun.chat",
      "operationCode": "inference.generate",
      "billability": "chargeable",
      "chargeTiming": "usage_reported",
      "calculationMode": "per_unit",
      "quantityAggregation": "sum",
      "conditions": [],
      "rateHash": "8ab61fe3cfd86ae15b696f7e9e8ad7089315873e501b9e0b4f2561559b7ae1a6"
    },
    {
      "currency": "CNY",
      "effectiveFrom": "2026-06-24T00:00:00Z",
      "meterCode": "llm_cache_read_token",
      "minimumQuantity": "0",
      "priceId": "stepfun-cn-step-3.5-flash-cache-read",
      "priceSide": "official",
      "pricingScope": "model",
      "quantityStep": "1",
      "source": {
        "observedAt": "2026-08-03T00:00:00Z",
        "sourceUrl": "https://platform.stepfun.com/docs/zh/guides/pricing/details"
      },
      "unitPrice": "0.140000",
      "unitSize": "1000000",
      "priceBookCode": "models.stepfun.cn.official",
      "productCode": "models.stepfun.chat",
      "operationCode": "inference.generate",
      "billability": "chargeable",
      "chargeTiming": "usage_reported",
      "calculationMode": "per_unit",
      "quantityAggregation": "sum",
      "conditions": [],
      "rateHash": "f4cc8930fd6b6b50f72f8068c2ca7e4b7a1498ddfb1dc1d68eb26cbf17697b52"
    },
    {
      "currency": "CNY",
      "effectiveFrom": "2026-06-24T00:00:00Z",
      "meterCode": "llm_output_token",
      "minimumQuantity": "0",
      "priceId": "stepfun-cn-step-3.5-flash-output",
      "priceSide": "official",
      "pricingScope": "model",
      "quantityStep": "1",
      "source": {
        "observedAt": "2026-08-03T00:00:00Z",
        "sourceUrl": "https://platform.stepfun.com/docs/zh/guides/pricing/details"
      },
      "unitPrice": "2.100000",
      "unitSize": "1000000",
      "priceBookCode": "models.stepfun.cn.official",
      "productCode": "models.stepfun.chat",
      "operationCode": "inference.generate",
      "billability": "chargeable",
      "chargeTiming": "usage_reported",
      "calculationMode": "per_unit",
      "quantityAggregation": "sum",
      "conditions": [],
      "rateHash": "e551bae36ec9df41fda3be42515efd553f5cb9350350de4048e2e578cb2bbabd"
    }
  ],
  "regionCode": "cn",
  "schemaVersion": "2.0.0",
  "vendorCode": "stepfun"
}
