{
  "catalogKey": "xai/grok-4.3",
  "currency": "USD",
  "modelId": "grok-4.3",
  "prices": [
    {
      "currency": "USD",
      "effectiveFrom": "2026-05-07T00:00:00Z",
      "meterCode": "llm_input_token",
      "minimumQuantity": "0",
      "priceId": "xai-grok-4.3-input",
      "priceSide": "official",
      "pricingScope": "model",
      "quantityStep": "1",
      "source": {
        "observedAt": "2026-07-26T00:00:00Z",
        "sourceUrl": "https://docs.x.ai/docs/models"
      },
      "unitPrice": "1.250000",
      "unitSize": "1000000"
    },
    {
      "currency": "USD",
      "effectiveFrom": "2026-05-07T00:00:00Z",
      "meterCode": "llm_output_token",
      "minimumQuantity": "0",
      "priceId": "xai-grok-4.3-output",
      "priceSide": "official",
      "pricingScope": "model",
      "quantityStep": "1",
      "source": {
        "observedAt": "2026-07-26T00:00:00Z",
        "sourceUrl": "https://docs.x.ai/docs/models"
      },
      "unitPrice": "2.500000",
      "unitSize": "1000000"
    }
  ],
  "regionCode": "global",
  "schemaVersion": "1.0.0",
  "vendorCode": "xai"
}
