{
  "catalogKey": "minimax/cn/MiniMax-M2.5-highspeed",
  "currency": "CNY",
  "modelId": "MiniMax-M2.5-highspeed",
  "prices": [
    {
      "currency": "CNY",
      "effectiveFrom": "2026-05-08T00:00:00Z",
      "meterCode": "llm_input_token",
      "minimumQuantity": "0",
      "priceId": "minimax-cn-minimax-m2-5-highspeed-input",
      "priceSide": "official",
      "pricingScope": "model",
      "quantityStep": "1",
      "source": {
        "observedAt": "2026-05-08T00:00:00Z",
        "sourceUrl": "https://platform.minimaxi.com/docs/guides/pricing-paygo"
      },
      "unitPrice": "4.200000",
      "unitSize": "1000000"
    },
    {
      "currency": "CNY",
      "effectiveFrom": "2026-05-08T00:00:00Z",
      "meterCode": "llm_cache_read_token",
      "minimumQuantity": "0",
      "priceId": "minimax-cn-minimax-m2-5-highspeed-cache-read",
      "priceSide": "official",
      "pricingScope": "model",
      "quantityStep": "1",
      "source": {
        "observedAt": "2026-05-08T00:00:00Z",
        "sourceUrl": "https://platform.minimaxi.com/docs/guides/pricing-paygo"
      },
      "unitPrice": "0.210000",
      "unitSize": "1000000"
    },
    {
      "currency": "CNY",
      "effectiveFrom": "2026-05-08T00:00:00Z",
      "meterCode": "llm_cache_write_token",
      "minimumQuantity": "0",
      "priceId": "minimax-cn-minimax-m2-5-highspeed-cache-write",
      "priceSide": "official",
      "pricingScope": "model",
      "quantityStep": "1",
      "source": {
        "observedAt": "2026-05-08T00:00:00Z",
        "sourceUrl": "https://platform.minimaxi.com/docs/guides/pricing-paygo"
      },
      "unitPrice": "2.625000",
      "unitSize": "1000000"
    },
    {
      "currency": "CNY",
      "effectiveFrom": "2026-05-08T00:00:00Z",
      "meterCode": "llm_output_token",
      "minimumQuantity": "0",
      "priceId": "minimax-cn-minimax-m2-5-highspeed-output",
      "priceSide": "official",
      "pricingScope": "model",
      "quantityStep": "1",
      "source": {
        "observedAt": "2026-05-08T00:00:00Z",
        "sourceUrl": "https://platform.minimaxi.com/docs/guides/pricing-paygo"
      },
      "unitPrice": "16.800000",
      "unitSize": "1000000"
    }
  ],
  "regionCode": "cn",
  "schemaVersion": "1.0.0",
  "vendorCode": "minimax"
}
