{
  "catalogKey": "google/veo-3.1-fast-generate-preview",
  "currency": "USD",
  "modelId": "veo-3.1-fast-generate-preview",
  "prices": [
    {
      "currency": "USD",
      "effectiveFrom": "2026-05-07T00:00:00Z",
      "meterCode": "video_output_second",
      "minimumQuantity": "0",
      "priceId": "google-veo-3.1-fast-generate-preview-second",
      "priceSide": "official",
      "pricingScope": "model",
      "quantityStep": "1",
      "source": {
        "observedAt": "2026-08-03T00:00:00Z",
        "sourceUrl": "https://ai.google.dev/gemini-api/docs/pricing"
      },
      "unitPrice": "0.100000",
      "unitSize": "1",
      "priceBookCode": "models.google.global.official",
      "productCode": "models.google.video",
      "operationCode": "video.generate",
      "billability": "chargeable",
      "chargeTiming": "successful_result",
      "calculationMode": "per_unit",
      "quantityAggregation": "sum",
      "conditions": [],
      "rateHash": "7b8d0e49eba04945f10f21c9ab5fe703e611d69e6e8c42310c4e0d139d50d9a1"
    }
  ],
  "regionCode": "global",
  "schemaVersion": "2.0.0",
  "vendorCode": "google"
}
