{
  "catalogKey": "bytedance/seed-tts-2.0-expressive",
  "currency": "CNY",
  "modelId": "seed-tts-2.0-expressive",
  "prices": [
    {
      "currency": "CNY",
      "effectiveFrom": "2026-07-02T00:00:00Z",
      "meterCode": "tts_input_character",
      "minimumQuantity": "0",
      "priceId": "bytedance-cn-seed-tts-2-0-expressive-character",
      "priceSide": "official",
      "pricingScope": "model",
      "quantityStep": "1",
      "source": {
        "observedAt": "2026-07-14T00:00:00Z",
        "sourceUrl": "https://www.volcengine.com/docs/6561/1359370"
      },
      "unitPrice": "0.280000",
      "unitSize": "1000"
    }
  ],
  "regionCode": "cn",
  "schemaVersion": "1.0.0",
  "vendorCode": "bytedance"
}
