{
  "catalogKey": "vidu/vidu-s1",
  "currency": "CNY",
  "modelId": "vidu-s1",
  "prices": [
    {
      "currency": "CNY",
      "effectiveFrom": "2026-07-03T00:00:00Z",
      "meterCode": "video_output_second",
      "minimumQuantity": "0",
      "priceId": "vidu-cn-vidu-s1-second-540p",
      "priceSide": "official",
      "pricingScope": "model",
      "quantityStep": "1",
      "source": {
        "observedAt": "2026-08-03T00:00:00Z",
        "sourceUrl": "https://platform.vidu.cn/docs/pricing"
      },
      "unitPrice": "0.025000",
      "unitSize": "1",
      "priceBookCode": "models.vidu.cn.official",
      "productCode": "models.vidu.streaming",
      "operationCode": "video.generate",
      "billability": "chargeable",
      "chargeTiming": "successful_result",
      "calculationMode": "per_unit",
      "quantityAggregation": "sum",
      "conditions": [],
      "rateHash": "b44f0bedc7dc1a14c22634645fb0820722eb81f1292e4aec706ffffa44ed33d8",
      "priority": 100,
      "rateVariant": "standard",
      "schedule": null
    }
  ],
  "regionCode": "cn",
  "schemaVersion": "2.0.0",
  "vendorCode": "vidu"
}
