{
  "catalogKey": "openai/global/gpt-image-2",
  "currency": "USD",
  "modelId": "gpt-image-2",
  "prices": [
    {
      "currency": "USD",
      "effectiveFrom": "2026-05-07T00:00:00Z",
      "inputType": "text",
      "mediaType": "text",
      "meterCode": "image_input_token",
      "minimumQuantity": "0",
      "priceId": "openai-gpt-image-2-text-input",
      "priceSide": "official",
      "pricingScope": "model",
      "quantityStep": "1",
      "source": {
        "observedAt": "2026-05-15T00:00:00Z",
        "sourceUrl": "https://openai.com/api/pricing/"
      },
      "unitPrice": "5.000000",
      "unitSize": "1000000"
    },
    {
      "currency": "USD",
      "effectiveFrom": "2026-05-07T00:00:00Z",
      "mediaType": "text",
      "meterCode": "llm_cache_read_token",
      "minimumQuantity": "0",
      "priceId": "openai-gpt-image-2-text-cache-read",
      "priceSide": "official",
      "pricingScope": "model",
      "quantityStep": "1",
      "source": {
        "observedAt": "2026-05-15T00:00:00Z",
        "sourceUrl": "https://openai.com/api/pricing/"
      },
      "unitPrice": "1.250000",
      "unitSize": "1000000"
    },
    {
      "currency": "USD",
      "effectiveFrom": "2026-05-07T00:00:00Z",
      "inputType": "image",
      "mediaType": "image",
      "meterCode": "image_input_token",
      "minimumQuantity": "0",
      "priceId": "openai-gpt-image-2-image-input",
      "priceSide": "official",
      "pricingScope": "model",
      "quantityStep": "1",
      "source": {
        "observedAt": "2026-05-15T00:00:00Z",
        "sourceUrl": "https://openai.com/api/pricing/"
      },
      "unitPrice": "8.000000",
      "unitSize": "1000000"
    },
    {
      "currency": "USD",
      "effectiveFrom": "2026-05-07T00:00:00Z",
      "mediaType": "image",
      "meterCode": "llm_cache_read_token",
      "minimumQuantity": "0",
      "priceId": "openai-gpt-image-2-image-cache-read",
      "priceSide": "official",
      "pricingScope": "model",
      "quantityStep": "1",
      "source": {
        "observedAt": "2026-05-15T00:00:00Z",
        "sourceUrl": "https://openai.com/api/pricing/"
      },
      "unitPrice": "2.000000",
      "unitSize": "1000000"
    },
    {
      "currency": "USD",
      "effectiveFrom": "2026-05-07T00:00:00Z",
      "meterCode": "image_output_token",
      "minimumQuantity": "0",
      "priceId": "openai-gpt-image-2-output",
      "priceSide": "official",
      "pricingScope": "model",
      "quantityStep": "1",
      "source": {
        "observedAt": "2026-05-15T00:00:00Z",
        "sourceUrl": "https://openai.com/api/pricing/"
      },
      "unitPrice": "30.000000",
      "unitSize": "1000000"
    }
  ],
  "regionCode": "global",
  "schemaVersion": "1.0.0",
  "vendorCode": "openai"
}
