{
  "catalogKey": "google/gemini-3-flash-preview",
  "currency": "USD",
  "modelId": "gemini-3-flash-preview",
  "prices": [
    {
      "currency": "USD",
      "effectiveFrom": "2026-05-07T00:00:00Z",
      "meterCode": "llm_input_token",
      "minimumQuantity": "0",
      "priceId": "google-gemini-3-flash-preview-input",
      "priceSide": "official",
      "pricingScope": "model",
      "quantityStep": "1",
      "source": {
        "observedAt": "2026-08-03T00:00:00Z",
        "sourceUrl": "https://ai.google.dev/gemini-api/docs/pricing"
      },
      "unitPrice": "0.500000",
      "unitSize": "1000000",
      "priceBookCode": "models.google.global.official",
      "productCode": "models.google.chat",
      "operationCode": "inference.generate",
      "billability": "chargeable",
      "chargeTiming": "usage_reported",
      "calculationMode": "per_unit",
      "quantityAggregation": "sum",
      "conditions": [],
      "rateHash": "ad01d13047ced3737c97965a6a6645d09bd894c04c3f52d0c13fd1cd003c73d9",
      "priority": 100,
      "rateVariant": "standard",
      "schedule": null
    },
    {
      "currency": "USD",
      "effectiveFrom": "2026-05-07T00:00:00Z",
      "mediaType": "audio",
      "meterCode": "audio_input_token",
      "minimumQuantity": "0",
      "priceId": "google-gemini-3-flash-preview-audio-input",
      "priceSide": "official",
      "pricingScope": "model",
      "quantityStep": "1",
      "source": {
        "observedAt": "2026-08-03T00:00:00Z",
        "sourceUrl": "https://ai.google.dev/gemini-api/docs/pricing"
      },
      "unitPrice": "1.000000",
      "unitSize": "1000000",
      "priceBookCode": "models.google.global.official",
      "productCode": "models.google.chat",
      "operationCode": "inference.generate",
      "billability": "chargeable",
      "chargeTiming": "usage_reported",
      "calculationMode": "per_unit",
      "quantityAggregation": "sum",
      "conditions": [
        {
          "dimensionCode": "media_type",
          "operator": "eq",
          "value": "audio"
        }
      ],
      "rateHash": "cff498898992d4ffb69604b7406cb76bd6aacb41b732c290de175e5cd0b1a50c",
      "priority": 100,
      "rateVariant": "standard",
      "schedule": null
    },
    {
      "currency": "USD",
      "effectiveFrom": "2026-05-07T00:00:00Z",
      "meterCode": "llm_cache_read_token",
      "minimumQuantity": "0",
      "priceId": "google-gemini-3-flash-preview-cache-read",
      "priceSide": "official",
      "pricingScope": "model",
      "quantityStep": "1",
      "source": {
        "observedAt": "2026-08-03T00:00:00Z",
        "sourceUrl": "https://ai.google.dev/gemini-api/docs/pricing"
      },
      "unitPrice": "0.050000",
      "unitSize": "1000000",
      "priceBookCode": "models.google.global.official",
      "productCode": "models.google.chat",
      "operationCode": "inference.generate",
      "billability": "chargeable",
      "chargeTiming": "usage_reported",
      "calculationMode": "per_unit",
      "quantityAggregation": "sum",
      "conditions": [],
      "rateHash": "204e203c0033d598ac76cbc1fe813bf3901027e5cfb7e36530ef1ecab7050fe4",
      "priority": 100,
      "rateVariant": "standard",
      "schedule": null
    },
    {
      "currency": "USD",
      "effectiveFrom": "2026-05-07T00:00:00Z",
      "meterCode": "llm_output_token",
      "minimumQuantity": "0",
      "priceId": "google-gemini-3-flash-preview-output",
      "priceSide": "official",
      "pricingScope": "model",
      "quantityStep": "1",
      "source": {
        "observedAt": "2026-08-03T00:00:00Z",
        "sourceUrl": "https://ai.google.dev/gemini-api/docs/pricing"
      },
      "unitPrice": "3.000000",
      "unitSize": "1000000",
      "priceBookCode": "models.google.global.official",
      "productCode": "models.google.chat",
      "operationCode": "inference.generate",
      "billability": "chargeable",
      "chargeTiming": "usage_reported",
      "calculationMode": "per_unit",
      "quantityAggregation": "sum",
      "conditions": [],
      "rateHash": "83d40f0e2c334b3da5a17808a1f26f9a55317b120db169f6f5fb52c05b4946c8",
      "priority": 100,
      "rateVariant": "standard",
      "schedule": null
    }
  ],
  "regionCode": "global",
  "schemaVersion": "2.0.0",
  "vendorCode": "google"
}
