{
  "catalogKey": "baidu/ernie-5.0-thinking-preview",
  "currency": "CNY",
  "modelId": "ernie-5.0-thinking-preview",
  "prices": [
    {
      "currency": "CNY",
      "effectiveFrom": "2026-07-14T00:00:00Z",
      "meterCode": "llm_input_token",
      "minimumQuantity": "0",
      "priceId": "baidu-cn-ernie-5.0-thinking-preview-input",
      "priceSide": "official",
      "pricingScope": "model",
      "quantityStep": "1",
      "source": {
        "observedAt": "2026-07-14T00:00:00Z",
        "sourceUrl": "https://cloud.baidu.com/doc/qianfan-docs/s/7m95lyy43"
      },
      "unitPrice": "6.000000",
      "unitSize": "1000000"
    },
    {
      "currency": "CNY",
      "effectiveFrom": "2026-07-14T00:00:00Z",
      "meterCode": "llm_input_token",
      "minimumQuantity": "32000",
      "priceId": "baidu-cn-ernie-5.0-thinking-preview-input-above-32k",
      "priceSide": "official",
      "pricingScope": "model",
      "quantityStep": "1",
      "source": {
        "observedAt": "2026-07-14T00:00:00Z",
        "sourceUrl": "https://cloud.baidu.com/doc/qianfan-docs/s/7m95lyy43"
      },
      "thresholdTokens": 32000,
      "tierCode": "above_32k_tokens",
      "unitPrice": "10.000000",
      "unitSize": "1000000"
    },
    {
      "currency": "CNY",
      "effectiveFrom": "2026-07-14T00:00:00Z",
      "meterCode": "llm_output_token",
      "minimumQuantity": "0",
      "priceId": "baidu-cn-ernie-5.0-thinking-preview-output",
      "priceSide": "official",
      "pricingScope": "model",
      "quantityStep": "1",
      "source": {
        "observedAt": "2026-07-14T00:00:00Z",
        "sourceUrl": "https://cloud.baidu.com/doc/qianfan-docs/s/7m95lyy43"
      },
      "unitPrice": "24.000000",
      "unitSize": "1000000"
    },
    {
      "currency": "CNY",
      "effectiveFrom": "2026-07-14T00:00:00Z",
      "meterCode": "llm_output_token",
      "minimumQuantity": "32000",
      "priceId": "baidu-cn-ernie-5.0-thinking-preview-output-above-32k",
      "priceSide": "official",
      "pricingScope": "model",
      "quantityStep": "1",
      "source": {
        "observedAt": "2026-07-14T00:00:00Z",
        "sourceUrl": "https://cloud.baidu.com/doc/qianfan-docs/s/7m95lyy43"
      },
      "thresholdTokens": 32000,
      "tierCode": "above_32k_tokens",
      "unitPrice": "40.000000",
      "unitSize": "1000000"
    }
  ],
  "regionCode": "cn",
  "schemaVersion": "1.0.0",
  "vendorCode": "baidu"
}
