{
  "catalogKey": "moonshot/kimi-k2.5",
  "currency": "USD",
  "modelId": "kimi-k2.5",
  "prices": [
    {
      "currency": "USD",
      "effectiveFrom": "2026-05-08T00:00:00Z",
      "meterCode": "llm_cache_read_token",
      "minimumQuantity": "0",
      "priceId": "moonshot-global-kimi-k2-5-cache-read",
      "priceSide": "official",
      "pricingScope": "model",
      "quantityStep": "1",
      "source": {
        "observedAt": "2026-06-24T00:00:00Z",
        "sourceUrl": "https://platform.kimi.ai/"
      },
      "unitPrice": "0.100000",
      "unitSize": "1000000"
    },
    {
      "currency": "USD",
      "effectiveFrom": "2026-05-08T00:00:00Z",
      "meterCode": "llm_input_token",
      "minimumQuantity": "0",
      "priceId": "moonshot-global-kimi-k2-5-input",
      "priceSide": "official",
      "pricingScope": "model",
      "quantityStep": "1",
      "source": {
        "observedAt": "2026-06-24T00:00:00Z",
        "sourceUrl": "https://platform.kimi.ai/"
      },
      "unitPrice": "0.600000",
      "unitSize": "1000000"
    },
    {
      "currency": "USD",
      "effectiveFrom": "2026-05-08T00:00:00Z",
      "meterCode": "llm_output_token",
      "minimumQuantity": "0",
      "priceId": "moonshot-global-kimi-k2-5-output",
      "priceSide": "official",
      "pricingScope": "model",
      "quantityStep": "1",
      "source": {
        "observedAt": "2026-06-24T00:00:00Z",
        "sourceUrl": "https://platform.kimi.ai/"
      },
      "unitPrice": "3.000000",
      "unitSize": "1000000"
    }
  ],
  "regionCode": "global",
  "schemaVersion": "1.0.0",
  "vendorCode": "moonshot"
}
