{
  "catalogKey": "anthropic/claude-sonnet-4-6",
  "currency": "USD",
  "modelId": "claude-sonnet-4-6",
  "prices": [
    {
      "currency": "USD",
      "effectiveFrom": "2026-05-07T00:00:00Z",
      "meterCode": "llm_input_token",
      "minimumQuantity": "0",
      "priceId": "anthropic-claude-sonnet-4-6-input",
      "priceSide": "official",
      "pricingScope": "model",
      "quantityStep": "1",
      "source": {
        "observedAt": "2026-08-13T00:00:00Z",
        "sourceUrl": "https://platform.claude.com/docs/en/about-claude/pricing"
      },
      "unitPrice": "3.000000",
      "unitSize": "1000000",
      "priceBookCode": "models.anthropic.global.official",
      "productCode": "models.anthropic.chat",
      "operationCode": "inference.generate",
      "billability": "chargeable",
      "chargeTiming": "usage_reported",
      "calculationMode": "per_unit",
      "quantityAggregation": "sum",
      "conditions": [],
      "rateHash": "137443331415c6fea64b3004361b89ca96a423bd3802f38105cd8ec0f7d485b6",
      "priority": 100,
      "rateVariant": "standard",
      "schedule": null
    },
    {
      "currency": "USD",
      "effectiveFrom": "2026-05-07T00:00:00Z",
      "meterCode": "llm_output_token",
      "minimumQuantity": "0",
      "priceId": "anthropic-claude-sonnet-4-6-output",
      "priceSide": "official",
      "pricingScope": "model",
      "quantityStep": "1",
      "source": {
        "observedAt": "2026-08-13T00:00:00Z",
        "sourceUrl": "https://platform.claude.com/docs/en/about-claude/pricing"
      },
      "unitPrice": "15.000000",
      "unitSize": "1000000",
      "priceBookCode": "models.anthropic.global.official",
      "productCode": "models.anthropic.chat",
      "operationCode": "inference.generate",
      "billability": "chargeable",
      "chargeTiming": "usage_reported",
      "calculationMode": "per_unit",
      "quantityAggregation": "sum",
      "conditions": [],
      "rateHash": "836ef572a436a17e542e2f4a644f3c50c9692e77e31558884672ea930dd04757",
      "priority": 100,
      "rateVariant": "standard",
      "schedule": null
    },
    {
      "currency": "USD",
      "effectiveFrom": "2026-05-07T00:00:00Z",
      "meterCode": "llm_cache_write_token",
      "minimumQuantity": "0",
      "priceId": "anthropic-claude-sonnet-4-6-cache-write",
      "priceSide": "official",
      "pricingScope": "model",
      "quantityStep": "1",
      "source": {
        "observedAt": "2026-08-13T00:00:00Z",
        "sourceUrl": "https://platform.claude.com/docs/en/about-claude/pricing"
      },
      "tierCode": "cache_write_5m",
      "unitPrice": "3.750000",
      "unitSize": "1000000",
      "priceBookCode": "models.anthropic.global.official",
      "productCode": "models.anthropic.chat",
      "operationCode": "inference.generate",
      "billability": "chargeable",
      "chargeTiming": "usage_reported",
      "calculationMode": "per_unit",
      "quantityAggregation": "sum",
      "conditions": [
        {
          "dimensionCode": "tier_code",
          "operator": "eq",
          "value": "cache_write_5m"
        }
      ],
      "rateHash": "dd4a87e98edb3d9cee4240dc132dda4b840c59e54e2861cfefdaf01b43aedf5a",
      "priority": 100,
      "rateVariant": "standard",
      "schedule": null
    },
    {
      "currency": "USD",
      "effectiveFrom": "2026-05-07T00:00:00Z",
      "meterCode": "llm_cache_write_token",
      "minimumQuantity": "0",
      "priceId": "anthropic-claude-sonnet-4-6-cache-write-1h",
      "priceSide": "official",
      "pricingScope": "model",
      "quantityStep": "1",
      "source": {
        "observedAt": "2026-08-13T00:00:00Z",
        "sourceUrl": "https://platform.claude.com/docs/en/about-claude/pricing"
      },
      "tierCode": "cache_write_1h",
      "unitPrice": "6.000000",
      "unitSize": "1000000",
      "priceBookCode": "models.anthropic.global.official",
      "productCode": "models.anthropic.chat",
      "operationCode": "inference.generate",
      "billability": "chargeable",
      "chargeTiming": "usage_reported",
      "calculationMode": "per_unit",
      "quantityAggregation": "sum",
      "conditions": [
        {
          "dimensionCode": "tier_code",
          "operator": "eq",
          "value": "cache_write_1h"
        }
      ],
      "rateHash": "2b75bb16b5b17fc421b425a54c71796c5643380742e530e59eb34bd042229828",
      "priority": 100,
      "rateVariant": "standard",
      "schedule": null
    },
    {
      "currency": "USD",
      "effectiveFrom": "2026-05-07T00:00:00Z",
      "meterCode": "llm_cache_read_token",
      "minimumQuantity": "0",
      "priceId": "anthropic-claude-sonnet-4-6-cache-read",
      "priceSide": "official",
      "pricingScope": "model",
      "quantityStep": "1",
      "source": {
        "observedAt": "2026-08-13T00:00:00Z",
        "sourceUrl": "https://platform.claude.com/docs/en/about-claude/pricing"
      },
      "unitPrice": "0.300000",
      "unitSize": "1000000",
      "priceBookCode": "models.anthropic.global.official",
      "productCode": "models.anthropic.chat",
      "operationCode": "inference.generate",
      "billability": "chargeable",
      "chargeTiming": "usage_reported",
      "calculationMode": "per_unit",
      "quantityAggregation": "sum",
      "conditions": [],
      "rateHash": "718de768dfca40589ab85ac8b8c35e44238a0947d76e437bd78844a37f7f9966",
      "priority": 100,
      "rateVariant": "standard",
      "schedule": null
    }
  ],
  "regionCode": "global",
  "schemaVersion": "2.0.0",
  "vendorCode": "anthropic"
}
