{
  "catalogKey": "google/gemini-3.1-flash-image",
  "currency": "USD",
  "modelId": "gemini-3.1-flash-image",
  "prices": [
    {
      "currency": "USD",
      "effectiveFrom": "2026-07-02T00:00:00Z",
      "meterCode": "llm_input_token",
      "minimumQuantity": "0",
      "priceId": "google-gemini-3.1-flash-image-text-input",
      "priceSide": "official",
      "pricingScope": "model",
      "quantityStep": "1",
      "source": {
        "observedAt": "2026-08-03T00:00:00Z",
        "sourceUrl": "https://ai.google.dev/gemini-api/docs/pricing"
      },
      "unitPrice": "0.500000",
      "unitSize": "1000000",
      "priceBookCode": "models.google.global.official",
      "productCode": "models.google.image",
      "operationCode": "image.generate",
      "billability": "chargeable",
      "chargeTiming": "usage_reported",
      "calculationMode": "per_unit",
      "quantityAggregation": "sum",
      "conditions": [],
      "rateHash": "e15b2d2c2090090a0c06fa391d265aee556296c3dda5821a6104a76538ab9d5f",
      "priority": 100,
      "rateVariant": "standard",
      "schedule": null
    },
    {
      "currency": "USD",
      "effectiveFrom": "2026-07-02T00:00:00Z",
      "meterCode": "image_output_token",
      "minimumQuantity": "0",
      "outputType": "image",
      "priceId": "google-gemini-3.1-flash-image-image-output",
      "priceSide": "official",
      "pricingScope": "model",
      "quantityStep": "1",
      "source": {
        "observedAt": "2026-08-03T00:00:00Z",
        "sourceUrl": "https://ai.google.dev/gemini-api/docs/pricing"
      },
      "unitPrice": "60.000000",
      "unitSize": "1000000",
      "priceBookCode": "models.google.global.official",
      "productCode": "models.google.image",
      "operationCode": "image.generate",
      "billability": "chargeable",
      "chargeTiming": "usage_reported",
      "calculationMode": "per_unit",
      "quantityAggregation": "sum",
      "conditions": [
        {
          "dimensionCode": "output_type",
          "operator": "eq",
          "value": "image"
        }
      ],
      "rateHash": "40e791711e61c1c23d7327f4651a3dc70cdc621568f50ea5ba4d2950760daed8",
      "priority": 100,
      "rateVariant": "standard",
      "schedule": null
    }
  ],
  "regionCode": "global",
  "schemaVersion": "2.0.0",
  "vendorCode": "google"
}
