{
  "catalogKey": "bytedance/doubao-seed-2-0-lite-260215",
  "currency": "CNY",
  "modelId": "doubao-seed-2-0-lite-260215",
  "prices": [
    {
      "currency": "CNY",
      "effectiveFrom": "2026-06-14T00:00:00Z",
      "meterCode": "llm_input_token",
      "minimumQuantity": "0",
      "priceId": "bytedance-cn-seed-2-0-lite-input",
      "priceSide": "official",
      "pricingScope": "model",
      "quantityStep": "1",
      "source": {
        "observedAt": "2026-08-03T00:00:00Z",
        "sourceUrl": "https://www.volcengine.com/docs/82379/1544106"
      },
      "unitPrice": "1.600000",
      "unitSize": "1000000",
      "priceBookCode": "models.bytedance.cn.official",
      "productCode": "models.bytedance.chat",
      "operationCode": "inference.generate",
      "billability": "chargeable",
      "chargeTiming": "usage_reported",
      "calculationMode": "per_unit",
      "quantityAggregation": "sum",
      "conditions": [],
      "rateHash": "d93be2f32dd52c88185531b9f8a4def75371ec4764414835efe43771545f97ba"
    },
    {
      "currency": "CNY",
      "effectiveFrom": "2026-06-14T00:00:00Z",
      "meterCode": "llm_output_token",
      "minimumQuantity": "0",
      "priceId": "bytedance-cn-seed-2-0-lite-output",
      "priceSide": "official",
      "pricingScope": "model",
      "quantityStep": "1",
      "source": {
        "observedAt": "2026-08-03T00:00:00Z",
        "sourceUrl": "https://www.volcengine.com/docs/82379/1544106"
      },
      "unitPrice": "8.000000",
      "unitSize": "1000000",
      "priceBookCode": "models.bytedance.cn.official",
      "productCode": "models.bytedance.chat",
      "operationCode": "inference.generate",
      "billability": "chargeable",
      "chargeTiming": "usage_reported",
      "calculationMode": "per_unit",
      "quantityAggregation": "sum",
      "conditions": [],
      "rateHash": "36c1f872e53e630d376c4252d3e0dca4f83cfdf0945e5b1536368fdc75c4dd21"
    }
  ],
  "regionCode": "cn",
  "schemaVersion": "2.0.0",
  "vendorCode": "bytedance"
}
